{
  "id": "S-008",
  "title": "Cost consequences of a nurse-led telemonitoring program for heart failure: payer-perspective analysis",
  "authors": [
    "Okafor C",
    "Lindqvist M"
  ],
  "year": 2024,
  "venue": "Health Economics in Practice",
  "doi": "10.9999/fict.2024.0201",
  "found_via": "search:Q-01",
  "screening": {
    "status": "included",
    "criterion": "HF population; RPM intervention; cost outcome; economic analysis of trial data",
    "date": "2026-07-04"
  }
}
